2016-09-22 12:54:19.745266 IP google-public-dns-a.google.com.domain > c-73-202-157-15.hsd1.ca.comcast.net.48847: 10140 1/0/0 A 216.58.194.164 (48)
2016-09-22 12:54:19.752966 IP google-public-dns-a.google.com.domain > c-73-202-157-15.hsd1.ca.comcast.net.48847: 2193 1/0/0 AAAA 2607:f8b0:4005:804::2004 (60)
2016-09-22 12:55:22.485591 IP google-public-dns-a.google.com.domain > c-73-202-157-15.hsd1.ca.comcast.net.45658: 37587 1/0/0 A 216.58.194.164 (48)
2016-09-22 12:55:22.490629 IP google-public-dns-a.google.com.domain > c-73-202-157-15.hsd1.ca.comcast.net.45658: 8726 1/0/0 AAAA 2607:f8b0:4005:804::2004 (60)
2016-09-22 12:56:25.275875 IP google-public-dns-a.google.com.domain > c-73-202-157-15.hsd1.ca.comcast.net.35514: 49778 1/0/0 A 216.58.195.68 (48)
2016-09-22 12:56:25.280477 IP google-public-dns-a.google.com.domain > c-73-202-157-15.hsd1.ca.comcast.net.35514: 27087 1/0/0 AAAA 2607:f8b0:4005:805::2004 (60)
2016-09-22 12:57:28.017499 IP google-public-dns-a.google.com.domain > c-73-202-157-15.hsd1.ca.comcast.net.42145: 14954 1/0/0 A 216.58.194.164 (48)
2016-09-22 12:57:28.022034 IP google-public-dns-a.google.com.domain > c-73-202-157-15.hsd1.ca.comcast.net.42145: 4357 1/0/0 AAAA 2607:f8b0:4005:805::2004 (60)
2016-09-22 12:58:30.745855 IP google-public-dns-a.google.com.domain > c-73-202-157-15.hsd1.ca.comcast.net.51690: 26871 1/0/0 A 216.58.195.228 (48)
2016-09-22 12:58:30.768537 IP google-public-dns-a.google.com.domain > c-73-202-157-15.hsd1.ca.comcast.net.51690: 50665 1/0/0 AAAA 2607:f8b0:4005:807::2004 (60)
2016-09-22 12:59:33.492689 IP google-public-dns-a.google.com.domain > c-73-202-157-15.hsd1.ca.comcast.net.38138: 39990 1/0/0 A 216.58.192.4 (48)
2016-09-22 12:59:33.496959 IP google-public-dns-a.google.com.domain > c-73-202-157-15.hsd1.ca.comcast.net.38138: 31107 1/0/0 AAAA 2607:f8b0:4005:805::2004 (60)
2016-09-22 13:00:36.171269 IP google-public-dns-a.google.com.domain > c-73-202-157-15.hsd1.ca.comcast.net.33240: 61291 1/0/0 A 216.58.195.68 (48)
2016-09-22 13:00:36.175594 IP google-public-dns-a.google.com.domain > c-73-202-157-15.hsd1.ca.comcast.net.33240: 27476 1/0/0 AAAA 2607:f8b0:4005:806::2004 (60)
2016-09-22 13:01:38.852964 IP google-public-dns-a.google.com.domain > c-73-202-157-15.hsd1.ca.comcast.net.55666: 14691 1/0/0 A 216.58.195.68 (48)
2016-09-22 13:01:38.857696 IP google-public-dns-a.google.com.domain > c-73-202-157-15.hsd1.ca.comcast.net.55666: 3442 1/0/0 AAAA 2607:f8b0:4005:807::2004 (60)
2016-09-22 13:02:41.654415 IP google-public-dns-a.google.com.domain > c-73-202-157-15.hsd1.ca.comcast.net.35614: 64496 1/0/0 A 216.58.192.4 (48)
2016-09-22 13:02:41.659117 IP google-public-dns-a.google.com.domain > c-73-202-157-15.hsd1.ca.comcast.net.35614: 61295 1/0/0 AAAA 2607:f8b0:4005:805::2004 (60)
2016-09-22 13:03:44.452857 IP google-public-dns-a.google.com.domain > c-73-202-157-15.hsd1.ca.comcast.net.39031: 1602 1/0/0 A 216.58.195.68 (48)
2016-09-22 13:03:44.457605 IP google-public-dns-a.google.com.domain > c-73-202-157-15.hsd1.ca.comcast.net.39031: 9236 1/0/0 AAAA 2607:f8b0:4005:807::2004 (60)
2016-09-22 13:04:47.218209 IP google-public-dns-a.google.com.domain > c-73-202-157-15.hsd1.ca.comcast.net.59917: 36497 1/0/0 A 216.58.195.228 (48)
2016-09-22 13:04:47.222804 IP google-public-dns-a.google.com.domain > c-73-202-157-15.hsd1.ca.comcast.net.59917: 65294 1/0/0 AAAA 2607:f8b0:4005:805::2004 (60)
2016-09-22 13:05:27.278704 IP resolver1.opendns.com.domain > c-73-202-157-15.hsd1.ca.comcast.net.9606: 35999 4/0/0 CNAME time-ios.g.aaplimg.com., A 17.253.4.125, A 17.253.4.253, A 17.253.26.125 (117)
2016-09-22 13:05:27.283326 IP resolver1.opendns.com.domain > c-73-202-157-15.hsd1.ca.comcast.net.33839: 1692 1/1/0 CNAME time-ios.g.aaplimg.com. (143)
2016-09-22 13:05:49.904293 IP google-public-dns-a.google.com.domain > c-73-202-157-15.hsd1.ca.comcast.net.54765: 48900 1/0/0 A 216.58.195.228 (48)
2016-09-22 13:05:49.908907 IP google-public-dns-a.google.com.domain > c-73-202-157-15.hsd1.ca.comcast.net.54765: 34554 1/0/0 AAAA 2607:f8b0:4005:804::2004 (60)
2016-09-22 13:05:51.218301 IP 198.154.63.50.40472 > c-73-202-157-15.hsd1.ca.comcast.net.domain: 63790+ [1au] ANY? . (28)
2016-09-22 13:06:52.649552 IP google-public-dns-a.google.com.domain > c-73-202-157-15.hsd1.ca.comcast.net.60779: 11168 1/0/0 A 216.58.192.4 (48)
2016-09-22 13:06:52.654472 IP google-public-dns-a.google.com.domain > c-73-202-157-15.hsd1.ca.comcast.net.60779: 54597 1/0/0 AAAA 2607:f8b0:4005:805::2004 (60)
2016-09-22 13:06:55.327457 IP resolver1.opendns.com.domain > c-73-202-157-15.hsd1.ca.comcast.net.1153: 43413 2/0/0 CNAME p11-ckdatabase-current.edge.icloud.apple-dns.net., A 17.248.128.177 (121)
2016-09-22 13:06:55.754658 IP resolver1.opendns.com.domain > c-73-202-157-15.hsd1.ca.comcast.net.52908: 59240 0/1/0 (151)
2016-09-22 13:07:55.336853 IP google-public-dns-a.google.com.domain > c-73-202-157-15.hsd1.ca.comcast.net.53608: 9255 1/0/0 A 216.58.195.228 (48)
2016-09-22 13:07:55.341434 IP google-public-dns-a.google.com.domain > c-73-202-157-15.hsd1.ca.comcast.net.53608: 31240 1/0/0 AAAA 2607:f8b0:4005:805::2004 (60)
2016-09-22 13:08:17.200134 IP resolver1.opendns.com.domain > c-73-202-157-15.hsd1.ca.comcast.net.7192: 35296 2/0/0 CNAME p11-caldav-current.edge.icloud.apple-dns.net., A 17.248.128.240 (113)
2016-09-22 13:08:18.293263 IP resolver1.opendns.com.domain > c-73-202-157-15.hsd1.ca.comcast.net.27794: 30813* 0/1/0 (117)
2016-09-22 13:08:18.293462 IP resolver1.opendns.com.domain > c-73-202-157-15.hsd1.ca.comcast.net.13381: 56361 NXDomain 0/1/0 (127)
2016-09-22 13:08:18.293468 IP resolver1.opendns.com.domain > c-73-202-157-15.hsd1.ca.comcast.net.58669: 42552 NXDomain 0/1/0 (130)
2016-09-22 13:08:18.293594 IP resolver1.opendns.com.domain > c-73-202-157-15.hsd1.ca.comcast.net.24943: 60341 3/0/0 A 17.178.96.59, A 17.142.160.59, A 17.172.224.47 (75)
2016-09-22 13:08:18.293671 IP resolver1.opendns.com.domain > c-73-202-157-15.hsd1.ca.comcast.net.23190: 11982 2/0/0 CNAME bolt.v.dropbox.com., A 162.125.18.133 (71)
2016-09-22 13:08:18.293801 IP resolver1.opendns.com.domain > c-73-202-157-15.hsd1.ca.comcast.net.44937: 33467 2/0/0 CNAME www3.l.google.com., A 216.58.195.78 (74)
2016-09-22 13:08:18.294084 IP resolver1.opendns.com.domain > c-73-202-157-15.hsd1.ca.comcast.net.45987: 33880 3/0/0 CNAME client.v.dropbox.com., A 108.160.172.204, A 108.160.172.236 (94)
2016-09-22 13:08:18.294216 IP resolver1.opendns.com.domain > c-73-202-157-15.hsd1.ca.comcast.net.42743: 37467 3/0/0 CNAME client.v.dropbox.com., A 108.160.172.236, A 108.160.172.204 (91)
2016-09-22 13:08:18.296142 IP resolver1.opendns.com.domain > c-73-202-157-15.hsd1.ca.comcast.net.8409: 2519 9/0/0 CNAME dl-debug.x.dropbox.com., A 52.72.198.82, A 54.164.239.10, A 52.72.155.188, A 52.87.78.178, A 54.164.252.96, A 52.7.106.188, A 52.73.148.88, A 52.73.27.41 (191)
2016-09-22 13:08:18.309954 IP resolver1.opendns.com.domain > c-73-202-157-15.hsd1.ca.comcast.net.7828: 17599 1/0/0 A 216.58.195.78 (50)
2016-09-22 13:08:18.316276 IP resolver1.opendns.com.domain > c-73-202-157-15.hsd1.ca.comcast.net.25301: 22572 2/0/0 CNAME 14-lvl3-pdl.vimeocdn.com.c.footprint.net., A 8.253.44.205 (112)
2016-09-22 13:08:18.321666 IP resolver1.opendns.com.domain > c-73-202-157-15.hsd1.ca.comcast.net.22888: 65459 2/0/0 CNAME talk.l.google.com., A 173.194.202.125 (70)
2016-09-22 13:08:18.326544 IP resolver1.opendns.com.domain > c-73-202-157-15.hsd1.ca.comcast.net.45108: 10271 1/0/0 A 173.194.202.125 (51)
2016-09-22 13:08:18.343834 IP resolver1.opendns.com.domain > c-73-202-157-15.hsd1.ca.comcast.net.14028: 37225 5/0/0 CNAME 1.courier-sandbox-push-apple.com.akadns.net., A 17.188.136.186, A 17.188.138.70, A 17.188.138.71, A 17.188.138.72 (171)
2016-09-22 13:08:18.400734 IP resolver1.opendns.com.domain > c-73-202-157-15.hsd1.ca.comcast.net.47232: 28890 4/0/0 CNAME ax.itunes.apple.com.edgesuite.net., CNAME a1108.da1.akamai.net., A 184.25.56.53, A 184.25.56.51 (147)
2016-09-22 13:08:18.402365 IP resolver1.opendns.com.domain > c-73-202-157-15.hsd1.ca.comcast.net.53809: 45550 2/0/0 CNAME p01-swscan.apple.com.akadns.net., A 17.146.232.12 (95)
2016-09-22 13:08:18.406055 IP resolver1.opendns.com.domain > c-73-202-157-15.hsd1.ca.comcast.net.8300: 5168 1/0/0 A 54.192.146.99 (55)
2016-09-22 13:08:18.436014 IP resolver1.opendns.com.domain > c-73-202-157-15.hsd1.ca.comcast.net.11541: 14496 3/0/0 CNAME d.v.dropbox.com., A 108.160.172.225, A 108.160.172.193 (81)
2016-09-22 13:08:18.444038 IP resolver1.opendns.com.domain > c-73-202-157-15.hsd1.ca.comcast.net.6795: 61980 9/0/0 CNAME sjc-courier.push-apple.com.akadns.net., A 17.249.12.17, A 17.249.12.15, A 17.249.12.14, A 17.249.12.19, A 17.249.12.16, A 17.249.12.24, A 17.249.12.18, A 17.249.12.23 (218)
2016-09-22 13:08:18.478451 IP resolver1.opendns.com.domain > c-73-202-157-15.hsd1.ca.comcast.net.56378: 60044 4/0/0 CNAME www.apple.com.edgekey.net., CNAME www.apple.com.edgekey.net.globalredir.akadns.net., CNAME e6858.dscc.akamaiedge.net., A 184.24.160.235 (181)
2016-09-22 13:08:18.567688 IP resolver1.opendns.com.domain > c-73-202-157-15.hsd1.ca.comcast.net.22619: 48148 10/0/0 CNAME 1.courier-push-apple.com.akadns.net., CNAME sjc-courier.push-apple.com.akadns.net., A 17.249.28.30, A 17.249.28.35, A 17.249.28.33, A 17.249.28.10, A 17.249.28.31, A 17.249.28.22, A 17.249.28.32, A 17.249.28.15 (256)
2016-09-22 13:08:18.957355 IP resolver1.opendns.com.domain > c-73-202-157-15.hsd1.ca.comcast.net.54332: 37845 2/0/0 CNAME clients.l.google.com., A 216.58.192.14 (77)
2016-09-22 13:08:19.794669 IP resolver1.opendns.com.domain > c-73-202-157-15.hsd1.ca.comcast.net.31683: 61628 4/0/0 CNAME init-p01st.push.apple.com.edgesuite.net., CNAME a1441.g4.akamai.net., A 184.25.56.34, A 184.25.56.51 (158)
2016-09-22 13:08:20.230069 IP resolver1.opendns.com.domain > c-73-202-157-15.hsd1.ca.comcast.net.63833: 55996 4/0/0 CNAME aia.entrust.net.edgesuite.net., CNAME a57.d.akamai.net., A 184.25.56.66, A 184.25.56.36 (132)
2016-09-22 13:08:20.816626 IP resolver1.opendns.com.domain > c-73-202-157-15.hsd1.ca.comcast.net.57191: 41921 10/0/0 CNAME 15.courier-push-apple.com.akadns.net., CNAME sjc-courier.push-apple.com.akadns.net., A 17.249.12.19, A 17.249.12.15, A 17.249.12.18, A 17.249.12.21, A 17.249.12.14, A 17.249.12.17, A 17.249.12.22, A 17.249.12.24 (258)
2016-09-22 13:08:21.220715 IP resolver1.opendns.com.domain > c-73-202-157-15.hsd1.ca.comcast.net.38805: 5353* 0/1/0 (117)
2016-09-22 13:08:21.225761 IP resolver1.opendns.com.domain > c-73-202-157-15.hsd1.ca.comcast.net.63362: 56046 NXDomain 0/1/0 (127)
2016-09-22 13:08:21.230366 IP resolver1.opendns.com.domain > c-73-202-157-15.hsd1.ca.comcast.net.63355: 19344 NXDomain 0/1/0 (130)
2016-09-22 13:08:22.208014 IP resolver1.opendns.com.domain > c-73-202-157-15.hsd1.ca.comcast.net.13767: 28080 2/0/0 CNAME talk.l.google.com., A 173.194.202.125 (70)
2016-09-22 13:08:22.208183 IP resolver1.opendns.com.domain > c-73-202-157-15.hsd1.ca.comcast.net.48509: 8326 10/0/0 CNAME 1.courier-push-apple.com.akadns.net., CNAME sjc-courier.push-apple.com.akadns.net., A 17.249.28.32, A 17.249.28.15, A 17.249.28.30, A 17.249.28.35, A 17.249.28.33, A 17.249.28.10, A 17.249.28.31, A 17.249.28.22 (256)
2016-09-22 13:08:22.208190 IP resolver1.opendns.com.domain > c-73-202-157-15.hsd1.ca.comcast.net.39127: 31497 2/1/0 CNAME ax.itunes.apple.com.edgesuite.net., CNAME a1108.da1.akamai.net. (188)
2016-09-22 13:08:22.208321 IP resolver1.opendns.com.domain > c-73-202-157-15.hsd1.ca.comcast.net.51903: 18112 0/1/0 (106)
2016-09-22 13:08:22.208328 IP resolver1.opendns.com.domain > c-73-202-157-15.hsd1.ca.comcast.net.50563: 29587 1/1/0 CNAME bolt.v.dropbox.com. (139)
2016-09-22 13:08:22.208470 IP resolver1.opendns.com.domain > c-73-202-157-15.hsd1.ca.comcast.net.1807: 34582 1/1/0 CNAME client.v.dropbox.com. (143)
2016-09-22 13:08:22.208476 IP resolver1.opendns.com.domain > c-73-202-157-15.hsd1.ca.comcast.net.20322: 24416 1/1/0 CNAME p11-caldav-current.edge.icloud.apple-dns.net. (182)
2016-09-22 13:08:22.214058 IP resolver1.opendns.com.domain > c-73-202-157-15.hsd1.ca.comcast.net.41614: 58175 2/0/0 CNAME www3.l.google.com., AAAA 2607:f8b0:4005:805::200e (86)
2016-09-22 13:08:22.223188 IP resolver1.opendns.com.domain > c-73-202-157-15.hsd1.ca.comcast.net.30619: 45061 1/0/0 AAAA 2607:f8b0:4005:807::200e (62)
2016-09-22 13:08:22.229910 IP resolver1.opendns.com.domain > c-73-202-157-15.hsd1.ca.comcast.net.49971: 30981 2/0/0 CNAME talk.l.google.com., AAAA 2607:f8b0:400e:c00::7d (82)
2016-09-22 13:08:22.238004 IP resolver1.opendns.com.domain > c-73-202-157-15.hsd1.ca.comcast.net.45683: 59549 2/0/0 CNAME www3.l.google.com., A 216.58.195.78 (74)
2016-09-22 13:08:22.277703 IP resolver1.opendns.com.domain > c-73-202-157-15.hsd1.ca.comcast.net.34437: 45468 2/1/0 CNAME 15.courier-push-apple.com.akadns.net., CNAME sjc-courier.push-apple.com.akadns.net. (206)
2016-09-22 13:08:22.278623 IP resolver1.opendns.com.domain > c-73-202-157-15.hsd1.ca.comcast.net.65109: 47659 2/1/0 CNAME 1.courier-push-apple.com.akadns.net., CNAME sjc-courier.push-apple.com.akadns.net. (204)
2016-09-22 13:08:22.282809 IP resolver1.opendns.com.domain > c-73-202-157-15.hsd1.ca.comcast.net.46150: 51295 1/1/0 CNAME 14-lvl3-pdl.vimeocdn.com.c.footprint.net. (161)
2016-09-22 13:08:22.311876 IP resolver1.opendns.com.domain > c-73-202-157-15.hsd1.ca.comcast.net.7311: 2399 5/0/0 CNAME www.apple.com.edgekey.net., CNAME www.apple.com.edgekey.net.globalredir.akadns.net., CNAME e6858.dscc.akamaiedge.net., AAAA 2600:1406:28:182::1aca, AAAA 2600:1406:28:19e::1aca (221)
2016-09-22 13:08:22.326435 IP resolver1.opendns.com.domain > c-73-202-157-15.hsd1.ca.comcast.net.64919: 63085 1/1/0 CNAME p01-swscan.apple.com.akadns.net. (155)
2016-09-22 13:08:22.356138 IP resolver1.opendns.com.domain > c-73-202-157-15.hsd1.ca.comcast.net.10407: 7543 1/1/0 CNAME 1.courier-sandbox-push-apple.com.akadns.net. (183)
2016-09-22 13:08:27.071500 IP resolver1.opendns.com.domain > c-73-202-157-15.hsd1.ca.comcast.net.59266: 11460 1/0/0 AAAA 2607:f8b0:400e:c03::bd (74)
2016-09-22 13:08:27.078872 IP resolver1.opendns.com.domain > c-73-202-157-15.hsd1.ca.comcast.net.33776: 30431 1/0/0 A 74.125.25.189 (62)
2016-09-22 13:08:50.159854 IP resolver1.opendns.com.domain > c-73-202-157-15.hsd1.ca.comcast.net.63997: 12786 4/0/0 CNAME weblb-wg.gslb.spotify.com., A 194.68.30.55, A 194.68.30.50, A 194.68.28.178 (115)
2016-09-22 13:08:50.227582 IP resolver1.opendns.com.domain > c-73-202-157-15.hsd1.ca.comcast.net.3990: 53924 2/0/0 CNAME guc1.gcplb.gslb.spotify.com., A 104.154.127.99 (83)
2016-09-22 13:08:50.324742 IP resolver1.opendns.com.domain > c-73-202-157-15.hsd1.ca.comcast.net.54473: 32070 1/0/0 A 8.23.224.120 (53)
2016-09-22 13:08:50.325035 IP resolver2.opendns.com.domain > c-73-202-157-15.hsd1.ca.comcast.net.54473: 32070 1/0/0 A 8.23.224.120 (53)
2016-09-22 13:08:50.330943 IP resolver1.opendns.com.domain > c-73-202-157-15.hsd1.ca.comcast.net.44246: 36305 1/0/0 A 8.23.224.120 (53)
2016-09-22 13:08:50.337054 IP resolver1.opendns.com.domain > c-73-202-157-15.hsd1.ca.comcast.net.55277: 38268 1/0/0 A 8.23.224.120 (53)
2016-09-22 13:08:52.797805 IP resolver1.opendns.com.domain > c-73-202-157-15.hsd1.ca.comcast.net.21567: 18445 1/0/0 A 17.248.128.238 (78)
2016-09-22 13:08:54.576569 IP resolver1.opendns.com.domain > c-73-202-157-15.hsd1.ca.comcast.net.26694: 27381 1/0/0 A 54.192.147.115 (65)
2016-09-22 13:08:54.643175 IP resolver1.opendns.com.domain > c-73-202-157-15.hsd1.ca.comcast.net.59451: 56886 0/1/0 (133)
2016-09-22 13:08:56.318816 IP resolver1.opendns.com.domain > c-73-202-157-15.hsd1.ca.comcast.net.44568: 43655 2/0/0 CNAME p07-calendars-current.edge.icloud.apple-dns.net., A 17.248.128.233 (119)
2016-09-22 13:08:56.372349 IP resolver1.opendns.com.domain > c-73-202-157-15.hsd1.ca.comcast.net.64193: 35485 1/1/0 CNAME p07-calendars-current.edge.icloud.apple-dns.net. (188)
2016-09-22 13:08:58.183140 IP google-public-dns-a.google.com.domain > c-73-202-157-15.hsd1.ca.comcast.net.42871: 20433 1/0/0 A 172.217.5.100 (48)
2016-09-22 13:08:58.188321 IP google-public-dns-a.google.com.domain > c-73-202-157-15.hsd1.ca.comcast.net.42871: 10906 1/0/0 AAAA 2607:f8b0:4005:805::2004 (60)
2016-09-22 13:08:59.895182 IP resolver1.opendns.com.domain > c-73-202-157-15.hsd1.ca.comcast.net.13046: 15860 2/0/0 CNAME clients.l.google.com., A 216.58.192.14 (77)
2016-09-22 13:08:59.916612 IP resolver1.opendns.com.domain > c-73-202-157-15.hsd1.ca.comcast.net.28415: 41283 2/0/0 CNAME clients.l.google.com., AAAA 2607:f8b0:4005:801::200e (89)
2016-09-22 13:10:00.900875 IP google-public-dns-a.google.com.domain > c-73-202-157-15.hsd1.ca.comcast.net.57423: 53101 1/0/0 A 172.217.5.100 (48)
2016-09-22 13:10:00.905538 IP google-public-dns-a.google.com.domain > c-73-202-157-15.hsd1.ca.comcast.net.57423: 31297 1/0/0 AAAA 2607:f8b0:4005:804::2004 (60)
2016-09-22 13:11:00.496973 IP google-public-dns-a.google.com.domain > c-73-202-157-15.hsd1.ca.comcast.net.36232: 25548 2/0/0 CNAME gstaticadssl.l.google.com., A 216.58.195.67 (87)
2016-09-22 13:11:00.502297 IP google-public-dns-a.google.com.domain > c-73-202-157-15.hsd1.ca.comcast.net.36232: 12437 2/0/0 CNAME gstaticadssl.l.google.com., AAAA 2607:f8b0:4005:801::2003 (99)
2016-09-22 13:11:03.638977 IP google-public-dns-a.google.com.domain > c-73-202-157-15.hsd1.ca.comcast.net.48751: 32990 1/0/0 A 172.217.5.100 (48)
2016-09-22 13:11:03.661715 IP google-public-dns-a.google.com.domain > c-73-202-157-15.hsd1.ca.comcast.net.48751: 35963 1/0/0 AAAA 2607:f8b0:4005:805::2004 (60)
2016-09-22 13:12:06.380148 IP google-public-dns-a.google.com.domain > c-73-202-157-15.hsd1.ca.comcast.net.59811: 32771 1/0/0 A 172.217.5.100 (48)
2016-09-22 13:12:06.385352 IP google-public-dns-a.google.com.domain > c-73-202-157-15.hsd1.ca.comcast.net.59811: 31371 1/0/0 AAAA 2607:f8b0:4005:806::2004 (60)
2016-09-22 13:13:09.173820 IP google-public-dns-a.google.com.domain > c-73-202-157-15.hsd1.ca.comcast.net.49073: 42180 1/0/0 A 172.217.5.100 (48)
2016-09-22 13:13:09.196506 IP google-public-dns-a.google.com.domain > c-73-202-157-15.hsd1.ca.comcast.net.49073: 54781 1/0/0 AAAA 2607:f8b0:4005:801::2004 (60)
2016-09-22 13:14:11.900578 IP google-public-dns-a.google.com.domain > c-73-202-157-15.hsd1.ca.comcast.net.39352: 60299 1/0/0 A 216.58.194.164 (48)
2016-09-22 13:14:11.905634 IP google-public-dns-a.google.com.domain > c-73-202-157-15.hsd1.ca.comcast.net.39352: 1818 1/0/0 AAAA 2607:f8b0:4005:805::2004 (60)
2016-09-22 13:15:14.603482 IP google-public-dns-a.google.com.domain > c-73-202-157-15.hsd1.ca.comcast.net.33719: 39001 1/0/0 A 172.217.5.100 (48)
2016-09-22 13:15:14.608637 IP google-public-dns-a.google.com.domain > c-73-202-157-15.hsd1.ca.comcast.net.33719: 12441 1/0/0 AAAA 2607:f8b0:4005:807::2004 (60)
2016-09-22 13:16:17.413778 IP google-public-dns-a.google.com.domain > c-73-202-157-15.hsd1.ca.comcast.net.58756: 5042 1/0/0 A 216.58.194.164 (48)
2016-09-22 13:16:17.418757 IP google-public-dns-a.google.com.domain > c-73-202-157-15.hsd1.ca.comcast.net.58756: 64714 1/0/0 AAAA 2607:f8b0:4005:801::2004 (60)
2016-09-22 13:17:20.144191 IP google-public-dns-a.google.com.domain > c-73-202-157-15.hsd1.ca.comcast.net.47327: 39281 1/0/0 A 172.217.5.100 (48)
2016-09-22 13:17:20.149764 IP google-public-dns-a.google.com.domain > c-73-202-157-15.hsd1.ca.comcast.net.47327: 15128 1/0/0 AAAA 2607:f8b0:4005:804::2004 (60)
2016-09-22 13:18:22.876609 IP google-public-dns-a.google.com.domain > c-73-202-157-15.hsd1.ca.comcast.net.52690: 9563 1/0/0 A 216.58.195.68 (48)
2016-09-22 13:18:22.881860 IP google-public-dns-a.google.com.domain > c-73-202-157-15.hsd1.ca.comcast.net.52690: 5790 1/0/0 AAAA 2607:f8b0:4005:807::2004 (60)
2016-09-22 13:19:25.636035 IP google-public-dns-a.google.com.domain > c-73-202-157-15.hsd1.ca.comcast.net.56162: 654 1/0/0 A 216.58.194.196 (48)
2016-09-22 13:19:25.640512 IP google-public-dns-a.google.com.domain > c-73-202-157-15.hsd1.ca.comcast.net.56162: 62845 1/0/0 AAAA 2607:f8b0:4005:804::2004 (60)
2016-09-22 13:20:28.352169 IP google-public-dns-a.google.com.domain > c-73-202-157-15.hsd1.ca.comcast.net.53064: 22116 1/0/0 AAAA 2607:f8b0:4005:804::2004 (60)
2016-09-22 13:20:28.365487 IP google-public-dns-a.google.com.domain > c-73-202-157-15.hsd1.ca.comcast.net.53064: 8817 1/0/0 A 216.58.194.196 (48)
2016-09-22 13:21:31.047393 IP google-public-dns-a.google.com.domain > c-73-202-157-15.hsd1.ca.comcast.net.44983: 65164 1/0/0 A 216.58.194.196 (48)
2016-09-22 13:21:31.052399 IP google-public-dns-a.google.com.domain > c-73-202-157-15.hsd1.ca.comcast.net.44983: 44213 1/0/0 AAAA 2607:f8b0:4005:804::2004 (60)
2016-09-22 13:22:33.777933 IP google-public-dns-a.google.com.domain > c-73-202-157-15.hsd1.ca.comcast.net.46369: 45674 1/0/0 A 216.58.194.196 (48)
2016-09-22 13:22:33.783063 IP google-public-dns-a.google.com.domain > c-73-202-157-15.hsd1.ca.comcast.net.46369: 48671 1/0/0 AAAA 2607:f8b0:4005:804::2004 (60)
2016-09-22 13:23:36.505278 IP google-public-dns-a.google.com.domain > c-73-202-157-15.hsd1.ca.comcast.net.48029: 53289 1/0/0 AAAA 2607:f8b0:4005:804::2004 (60)
2016-09-22 13:23:36.518360 IP google-public-dns-a.google.com.domain > c-73-202-157-15.hsd1.ca.comcast.net.48029: 50340 1/0/0 A 172.217.5.100 (48)
2016-09-22 13:24:39.310641 IP google-public-dns-a.google.com.domain > c-73-202-157-15.hsd1.ca.comcast.net.49024: 29830 1/0/0 A 216.58.192.4 (48)
2016-09-22 13:24:39.315236 IP google-public-dns-a.google.com.domain > c-73-202-157-15.hsd1.ca.comcast.net.49024: 7907 1/0/0 AAAA 2607:f8b0:4005:808::2004 (60)
2016-09-22 13:25:42.063025 IP google-public-dns-a.google.com.domain > c-73-202-157-15.hsd1.ca.comcast.net.33296: 51630 1/0/0 A 216.58.192.4 (48)
2016-09-22 13:25:42.085771 IP google-public-dns-a.google.com.domain > c-73-202-157-15.hsd1.ca.comcast.net.33296: 31610 1/0/0 AAAA 2607:f8b0:4005:808::2004 (60)
2016-09-22 13:26:44.832312 IP google-public-dns-a.google.com.domain > c-73-202-157-15.hsd1.ca.comcast.net.47606: 26110 1/0/0 A 216.58.194.196 (48)
2016-09-22 13:26:44.838089 IP google-public-dns-a.google.com.domain > c-73-202-157-15.hsd1.ca.comcast.net.47606: 22146 1/0/0 AAAA 2607:f8b0:4005:804::2004 (60)
2016-09-22 13:27:47.525208 IP google-public-dns-a.google.com.domain > c-73-202-157-15.hsd1.ca.comcast.net.56643: 2261 1/0/0 A 216.58.192.4 (48)
2016-09-22 13:27:47.529733 IP google-public-dns-a.google.com.domain > c-73-202-157-15.hsd1.ca.comcast.net.56643: 48935 1/0/0 AAAA 2607:f8b0:4005:805::2004 (60)
2016-09-22 13:28:50.262471 IP google-public-dns-a.google.com.domain > c-73-202-157-15.hsd1.ca.comcast.net.35804: 54541 1/0/0 AAAA 2607:f8b0:4005:808::2004 (60)
2016-09-22 13:28:50.272596 IP google-public-dns-a.google.com.domain > c-73-202-157-15.hsd1.ca.comcast.net.35804: 51098 1/0/0 A 172.217.5.100 (48)
2016-09-22 13:29:52.956716 IP google-public-dns-a.google.com.domain > c-73-202-157-15.hsd1.ca.comcast.net.49073: 15793 1/0/0 A 216.58.194.164 (48)
2016-09-22 13:29:52.961969 IP google-public-dns-a.google.com.domain > c-73-202-157-15.hsd1.ca.comcast.net.49073: 43860 1/0/0 AAAA 2607:f8b0:4005:807::2004 (60)
2016-09-22 13:30:55.706734 IP google-public-dns-a.google.com.domain > c-73-202-157-15.hsd1.ca.comcast.net.53422: 43209 1/0/0 A 172.217.5.100 (48)
2016-09-22 13:30:55.712033 IP google-public-dns-a.google.com.domain > c-73-202-157-15.hsd1.ca.comcast.net.53422: 43836 1/0/0 AAAA 2607:f8b0:4005:805::2004 (60)
2016-09-22 13:31:02.268441 IP resolver1.opendns.com.domain > c-73-202-157-15.hsd1.ca.comcast.net.29159: 35139 4/0/0 A 4.53.160.75, A 198.55.111.50, A 72.14.183.39, A 199.199.208.25 (96)
2016-09-22 13:31:58.416576 IP google-public-dns-a.google.com.domain > c-73-202-157-15.hsd1.ca.comcast.net.52702: 30105 1/0/0 A 216.58.192.4 (48)
2016-09-22 13:31:58.422882 IP google-public-dns-a.google.com.domain > c-73-202-157-15.hsd1.ca.comcast.net.52702: 17910 1/0/0 AAAA 2607:f8b0:4005:804::2004 (60)
2016-09-22 13:33:01.107139 IP google-public-dns-a.google.com.domain > c-73-202-157-15.hsd1.ca.comcast.net.51507: 39376 1/0/0 A 216.58.195.68 (48)
2016-09-22 13:33:01.112235 IP google-public-dns-a.google.com.domain > c-73-202-157-15.hsd1.ca.comcast.net.51507: 62634 1/0/0 AAAA 2607:f8b0:4005:808::2004 (60)
2016-09-22 13:34:03.878897 IP google-public-dns-a.google.com.domain > c-73-202-157-15.hsd1.ca.comcast.net.55324: 18247 1/0/0 A 216.58.192.4 (48)
2016-09-22 13:34:03.883774 IP google-public-dns-a.google.com.domain > c-73-202-157-15.hsd1.ca.comcast.net.55324: 41443 1/0/0 AAAA 2607:f8b0:4005:808::2004 (60)
2016-09-22 13:35:06.589790 IP google-public-dns-a.google.com.domain > c-73-202-157-15.hsd1.ca.comcast.net.57057: 3559 1/0/0 A 216.58.192.4 (48)
2016-09-22 13:35:06.593792 IP google-public-dns-a.google.com.domain > c-73-202-157-15.hsd1.ca.comcast.net.57057: 32746 1/0/0 AAAA 2607:f8b0:4005:808::2004 (60)
2016-09-22 13:36:09.370221 IP google-public-dns-a.google.com.domain > c-73-202-157-15.hsd1.ca.comcast.net.52550: 9091 1/0/0 A 216.58.195.68 (48)
2016-09-22 13:36:09.375673 IP google-public-dns-a.google.com.domain > c-73-202-157-15.hsd1.ca.comcast.net.52550: 52763 1/0/0 AAAA 2607:f8b0:4005:805::2004 (60)
2016-09-22 13:37:12.150849 IP google-public-dns-a.google.com.domain > c-73-202-157-15.hsd1.ca.comcast.net.39317: 62031 1/0/0 A 216.58.195.68 (48)
2016-09-22 13:37:12.174003 IP google-public-dns-a.google.com.domain > c-73-202-157-15.hsd1.ca.comcast.net.39317: 7300 1/0/0 AAAA 2607:f8b0:4005:805::2004 (60)
2016-09-22 13:38:14.931786 IP google-public-dns-a.google.com.domain > c-73-202-157-15.hsd1.ca.comcast.net.36422: 24803 1/0/0 A 172.217.5.100 (48)
2016-09-22 13:38:14.936515 IP google-public-dns-a.google.com.domain > c-73-202-157-15.hsd1.ca.comcast.net.36422: 44098 1/0/0 AAAA 2607:f8b0:4005:805::2004 (60)
2016-09-22 13:38:29.636775 IP resolver1.opendns.com.domain > c-73-202-157-15.hsd1.ca.comcast.net.14422: 38932 0/1/0 (114)
2016-09-22 13:38:30.642379 IP resolver1.opendns.com.domain > c-73-202-157-15.hsd1.ca.comcast.net.57166: 26307 3/0/0 A 17.253.4.125, A 17.253.4.253, A 17.253.26.125 (88)
2016-09-22 13:38:50.458188 IP resolver1.opendns.com.domain > c-73-202-157-15.hsd1.ca.comcast.net.59297: 3536 1/0/0 A 8.23.224.120 (53)
2016-09-22 13:38:50.458585 IP resolver2.opendns.com.domain > c-73-202-157-15.hsd1.ca.comcast.net.59297: 3536 1/0/0 A 8.23.224.120 (53)
2016-09-22 13:38:50.464496 IP resolver1.opendns.com.domain > c-73-202-157-15.hsd1.ca.comcast.net.51067: 58335 1/0/0 A 8.23.224.120 (53)
2016-09-22 13:38:50.468211 IP resolver1.opendns.com.domain > c-73-202-157-15.hsd1.ca.comcast.net.6254: 52675 1/0/0 A 8.23.224.120 (53)
2016-09-22 13:39:17.743631 IP google-public-dns-a.google.com.domain > c-73-202-157-15.hsd1.ca.comcast.net.32830: 39991 1/0/0 A 216.58.194.164 (48)
2016-09-22 13:39:17.749118 IP google-public-dns-a.google.com.domain > c-73-202-157-15.hsd1.ca.comcast.net.32830: 37420 1/0/0 AAAA 2607:f8b0:4005:804::2004 (60)
2016-09-22 13:39:24.061310 IP google-public-dns-a.google.com.domain > c-73-202-157-15.hsd1.ca.comcast.net.36976: 6950 2/0/0 CNAME googlehosted.l.googleusercontent.com., A 216.58.195.225 (88)
2016-09-22 13:39:24.065776 IP google-public-dns-a.google.com.domain > c-73-202-157-15.hsd1.ca.comcast.net.36976: 40776 2/0/0 CNAME googlehosted.l.googleusercontent.com., AAAA 2607:f8b0:4005:801::2001 (100)
2016-09-22 13:40:20.563821 IP google-public-dns-a.google.com.domain > c-73-202-157-15.hsd1.ca.comcast.net.56414: 15843 1/0/0 A 216.58.194.196 (48)
2016-09-22 13:40:20.568488 IP google-public-dns-a.google.com.domain > c-73-202-157-15.hsd1.ca.comcast.net.56414: 61081 1/0/0 AAAA 2607:f8b0:4005:804::2004 (60)
2016-09-22 13:41:23.374402 IP google-public-dns-a.google.com.domain > c-73-202-157-15.hsd1.ca.comcast.net.57692: 33900 1/0/0 A 216.58.194.164 (48)
2016-09-22 13:41:23.378935 IP google-public-dns-a.google.com.domain > c-73-202-157-15.hsd1.ca.comcast.net.57692: 7999 1/0/0 AAAA 2607:f8b0:4005:801::2004 (60)
2016-09-22 13:41:26.798531 IP google-public-dns-a.google.com.domain > c-73-202-157-15.hsd1.ca.comcast.net.38469: 45893 2/0/0 CNAME googlehosted.l.googleusercontent.com., A 216.58.195.225 (88)
2016-09-22 13:41:26.802684 IP google-public-dns-a.google.com.domain > c-73-202-157-15.hsd1.ca.comcast.net.38469: 52802 2/0/0 CNAME googlehosted.l.googleusercontent.com., AAAA 2607:f8b0:4005:805::2001 (100)
2016-09-22 13:42:26.136013 IP google-public-dns-a.google.com.domain > c-73-202-157-15.hsd1.ca.comcast.net.45375: 10627 1/0/0 A 216.58.194.164 (48)
2016-09-22 13:42:26.140391 IP google-public-dns-a.google.com.domain > c-73-202-157-15.hsd1.ca.comcast.net.45375: 14791 1/0/0 AAAA 2607:f8b0:4005:804::2004 (60)
2016-09-22 13:43:28.666886 IP google-public-dns-a.google.com.domain > c-73-202-157-15.hsd1.ca.comcast.net.35849: 24499 2/0/0 CNAME googlehosted.l.googleusercontent.com., A 172.217.5.97 (88)
2016-09-22 13:43:28.671036 IP google-public-dns-a.google.com.domain > c-73-202-157-15.hsd1.ca.comcast.net.35849: 63267 2/0/0 CNAME googlehosted.l.googleusercontent.com., AAAA 2607:f8b0:4005:804::2001 (100)
2016-09-22 13:43:28.837795 IP google-public-dns-a.google.com.domain > c-73-202-157-15.hsd1.ca.comcast.net.47819: 3184 1/0/0 A 216.58.194.164 (48)
2016-09-22 13:43:28.842865 IP google-public-dns-a.google.com.domain > c-73-202-157-15.hsd1.ca.comcast.net.47819: 58392 1/0/0 AAAA 2607:f8b0:4005:801::2004 (60)
2016-09-22 13:44:31.588260 IP google-public-dns-a.google.com.domain > c-73-202-157-15.hsd1.ca.comcast.net.52513: 45328 1/0/0 A 216.58.194.164 (48)
2016-09-22 13:44:31.592784 IP google-public-dns-a.google.com.domain > c-73-202-157-15.hsd1.ca.comcast.net.52513: 33800 1/0/0 AAAA 2607:f8b0:4005:805::2004 (60)
2016-09-22 13:45:30.675173 IP google-public-dns-a.google.com.domain > c-73-202-157-15.hsd1.ca.comcast.net.57133: 9240 2/0/0 CNAME googlehosted.l.googleusercontent.com., A 216.58.195.65 (88)
2016-09-22 13:45:30.681005 IP google-public-dns-a.google.com.domain > c-73-202-157-15.hsd1.ca.comcast.net.57133: 22540 2/0/0 CNAME googlehosted.l.googleusercontent.com., AAAA 2607:f8b0:4005:807::2001 (100)
2016-09-22 13:45:34.298131 IP google-public-dns-a.google.com.domain > c-73-202-157-15.hsd1.ca.comcast.net.54903: 7438 1/0/0 A 216.58.194.164 (48)
2016-09-22 13:45:34.303234 IP google-public-dns-a.google.com.domain > c-73-202-157-15.hsd1.ca.comcast.net.54903: 48403 1/0/0 AAAA 2607:f8b0:4005:807::2004 (60)
2016-09-22 13:46:36.999141 IP google-public-dns-a.google.com.domain > c-73-202-157-15.hsd1.ca.comcast.net.37485: 56204 1/0/0 A 216.58.195.68 (48)
2016-09-22 13:46:37.004196 IP google-public-dns-a.google.com.domain > c-73-202-157-15.hsd1.ca.comcast.net.37485: 65285 1/0/0 AAAA 2607:f8b0:4005:807::2004 (60)
2016-09-22 13:47:32.319895 IP google-public-dns-a.google.com.domain > c-73-202-157-15.hsd1.ca.comcast.net.60598: 56222 2/0/0 CNAME googlehosted.l.googleusercontent.com., A 172.217.5.97 (88)
2016-09-22 13:47:32.325229 IP google-public-dns-a.google.com.domain > c-73-202-157-15.hsd1.ca.comcast.net.60598: 25649 2/0/0 CNAME googlehosted.l.googleusercontent.com., AAAA 2607:f8b0:4005:804::2001 (100)
2016-09-22 13:47:39.720642 IP google-public-dns-a.google.com.domain > c-73-202-157-15.hsd1.ca.comcast.net.34577: 59008 1/0/0 A 216.58.195.68 (48)
2016-09-22 13:47:39.725093 IP google-public-dns-a.google.com.domain > c-73-202-157-15.hsd1.ca.comcast.net.34577: 54267 1/0/0 AAAA 2607:f8b0:4005:807::2004 (60)
2016-09-22 13:48:42.461758 IP google-public-dns-a.google.com.domain > c-73-202-157-15.hsd1.ca.comcast.net.56112: 49402 1/0/0 A 216.58.194.196 (48)
2016-09-22 13:48:42.467430 IP google-public-dns-a.google.com.domain > c-73-202-157-15.hsd1.ca.comcast.net.56112: 46329 1/0/0 AAAA 2607:f8b0:4005:807::2004 (60)
2016-09-22 13:49:34.438792 IP google-public-dns-a.google.com.domain > c-73-202-157-15.hsd1.ca.comcast.net.59744: 26524 2/0/0 CNAME googlehosted.l.googleusercontent.com., A 216.58.194.193 (88)
2016-09-22 13:49:34.443312 IP google-public-dns-a.google.com.domain > c-73-202-157-15.hsd1.ca.comcast.net.59744: 28935 2/0/0 CNAME googlehosted.l.googleusercontent.com., AAAA 2607:f8b0:4005:808::2001 (100)
2016-09-22 13:49:45.201287 IP google-public-dns-a.google.com.domain > c-73-202-157-15.hsd1.ca.comcast.net.33948: 59523 1/0/0 A 216.58.195.228 (48)
2016-09-22 13:49:45.210873 IP google-public-dns-a.google.com.domain > c-73-202-157-15.hsd1.ca.comcast.net.33948: 8718 1/0/0 AAAA 2607:f8b0:4005:808::2004 (60)
2016-09-22 13:50:47.911791 IP google-public-dns-a.google.com.domain > c-73-202-157-15.hsd1.ca.comcast.net.43522: 53220 1/0/0 A 216.58.194.196 (48)
2016-09-22 13:50:47.916383 IP google-public-dns-a.google.com.domain > c-73-202-157-15.hsd1.ca.comcast.net.43522: 33467 1/0/0 AAAA 2607:f8b0:4005:807::2004 (60)
2016-09-22 13:51:50.663516 IP google-public-dns-a.google.com.domain > c-73-202-157-15.hsd1.ca.comcast.net.52813: 26364 1/0/0 A 216.58.195.68 (48)
2016-09-22 13:51:50.668247 IP google-public-dns-a.google.com.domain > c-73-202-157-15.hsd1.ca.comcast.net.52813: 20541 1/0/0 AAAA 2607:f8b0:4005:808::2004 (60)
2016-09-22 13:52:23.353782 IP 209.126.136.2.35917 > c-73-202-157-15.hsd1.ca.comcast.net.domain: 43392+[|domain]
2016-09-22 13:52:53.487887 IP google-public-dns-a.google.com.domain > c-73-202-157-15.hsd1.ca.comcast.net.52280: 29246 1/0/0 AAAA 2607:f8b0:4005:804::2004 (60)
2016-09-22 13:52:53.501148 IP google-public-dns-a.google.com.domain > c-73-202-157-15.hsd1.ca.comcast.net.52280: 56893 1/0/0 A 216.58.194.196 (48)
2016-09-22 13:53:37.903210 IP google-public-dns-a.google.com.domain > c-73-202-157-15.hsd1.ca.comcast.net.46200: 58912 2/0/0 CNAME clients.l.google.com., A 216.58.194.206 (77)
2016-09-22 13:53:37.926050 IP google-public-dns-a.google.com.domain > c-73-202-157-15.hsd1.ca.comcast.net.46200: 24634 2/0/0 CNAME clients.l.google.com., AAAA 2607:f8b0:4005:807::200e (89)
2016-09-22 13:53:56.215636 IP google-public-dns-a.google.com.domain > c-73-202-157-15.hsd1.ca.comcast.net.48472: 16810 1/0/0 A 216.58.194.164 (48)
2016-09-22 13:53:56.220942 IP google-public-dns-a.google.com.domain > c-73-202-157-15.hsd1.ca.comcast.net.48472: 5910 1/0/0 AAAA 2607:f8b0:4005:808::2004 (60)
2016-09-22 13:54:59.006037 IP google-public-dns-a.google.com.domain > c-73-202-157-15.hsd1.ca.comcast.net.53603: 4232 1/0/0 A 216.58.194.164 (48)
2016-09-22 13:54:59.010664 IP google-public-dns-a.google.com.domain > c-73-202-157-15.hsd1.ca.comcast.net.53603: 4350 1/0/0 AAAA 2607:f8b0:4005:808::2004 (60)
2016-09-22 13:55:39.977513 IP google-public-dns-a.google.com.domain > c-73-202-157-15.hsd1.ca.comcast.net.36850: 55010 2/0/0 CNAME googlehosted.l.googleusercontent.com., A 216.58.194.193 (88)
2016-09-22 13:55:39.983884 IP google-public-dns-a.google.com.domain > c-73-202-157-15.hsd1.ca.comcast.net.36850: 21387 2/0/0 CNAME googlehosted.l.googleusercontent.com., AAAA 2607:f8b0:4005:801::2001 (100)
2016-09-22 13:56:01.702751 IP google-public-dns-a.google.com.domain > c-73-202-157-15.hsd1.ca.comcast.net.37540: 58302 1/0/0 A 216.58.194.196 (48)
2016-09-22 13:56:01.707628 IP google-public-dns-a.google.com.domain > c-73-202-157-15.hsd1.ca.comcast.net.37540: 48255 1/0/0 AAAA 2607:f8b0:4005:801::2004 (60)
2016-09-22 13:57:04.449311 IP google-public-dns-a.google.com.domain > c-73-202-157-15.hsd1.ca.comcast.net.56010: 41752 1/0/0 A 172.217.5.100 (48)
2016-09-22 13:57:04.454393 IP google-public-dns-a.google.com.domain > c-73-202-157-15.hsd1.ca.comcast.net.56010: 37041 1/0/0 AAAA 2607:f8b0:4005:804::2004 (60)
2016-09-22 13:57:41.756278 IP google-public-dns-a.google.com.domain > c-73-202-157-15.hsd1.ca.comcast.net.60412: 44356 2/0/0 CNAME googlehosted.l.googleusercontent.com., A 216.58.195.65 (88)
2016-09-22 13:57:41.761275 IP google-public-dns-a.google.com.domain > c-73-202-157-15.hsd1.ca.comcast.net.60412: 3326 2/0/0 CNAME googlehosted.l.googleusercontent.com., AAAA 2607:f8b0:4005:801::2001 (100)
2016-09-22 13:58:07.164096 IP google-public-dns-a.google.com.domain > c-73-202-157-15.hsd1.ca.comcast.net.55010: 3127 1/0/0 AAAA 2607:f8b0:4005:801::2004 (60)
2016-09-22 13:58:07.176488 IP google-public-dns-a.google.com.domain > c-73-202-157-15.hsd1.ca.comcast.net.55010: 19444 1/0/0 A 172.217.5.100 (48)
2016-09-22 13:59:09.868815 IP google-public-dns-a.google.com.domain > c-73-202-157-15.hsd1.ca.comcast.net.40231: 9060 1/0/0 A 216.58.195.68 (48)
2016-09-22 13:59:09.875775 IP google-public-dns-a.google.com.domain > c-73-202-157-15.hsd1.ca.comcast.net.40231: 16273 1/0/0 AAAA 2607:f8b0:4005:804::2004 (60)
2016-09-22 13:59:43.910807 IP google-public-dns-a.google.com.domain > c-73-202-157-15.hsd1.ca.comcast.net.55864: 28598 2/0/0 CNAME googlehosted.l.googleusercontent.com., A 216.58.192.1 (88)
2016-09-22 13:59:43.916159 IP google-public-dns-a.google.com.domain > c-73-202-157-15.hsd1.ca.comcast.net.55864: 55406 2/0/0 CNAME googlehosted.l.googleusercontent.com., AAAA 2607:f8b0:4005:801::2001 (100)
2016-09-22 14:00:12.619181 IP google-public-dns-a.google.com.domain > c-73-202-157-15.hsd1.ca.comcast.net.58151: 53644 1/0/0 A 216.58.192.4 (48)
2016-09-22 14:00:12.625434 IP google-public-dns-a.google.com.domain > c-73-202-157-15.hsd1.ca.comcast.net.58151: 27016 1/0/0 AAAA 2607:f8b0:4005:808::2004 (60)
2016-09-22 14:01:15.371241 IP google-public-dns-a.google.com.domain > c-73-202-157-15.hsd1.ca.comcast.net.54007: 31443 1/0/0 A 216.58.195.68 (48)
2016-09-22 14:01:15.376244 IP google-public-dns-a.google.com.domain > c-73-202-157-15.hsd1.ca.comcast.net.54007: 37150 1/0/0 AAAA 2607:f8b0:4005:801::2004 (60)
2016-09-22 14:02:18.062600 IP google-public-dns-a.google.com.domain > c-73-202-157-15.hsd1.ca.comcast.net.44989: 8683 1/0/0 A 216.58.194.196 (48)
2016-09-22 14:02:18.085686 IP google-public-dns-a.google.com.domain > c-73-202-157-15.hsd1.ca.comcast.net.44989: 47287 1/0/0 AAAA 2607:f8b0:4005:804::2004 (60)
2016-09-22 14:03:20.793825 IP google-public-dns-a.google.com.domain > c-73-202-157-15.hsd1.ca.comcast.net.60788: 42904 1/0/0 A 216.58.195.68 (48)
2016-09-22 14:03:20.799634 IP google-public-dns-a.google.com.domain > c-73-202-157-15.hsd1.ca.comcast.net.60788: 40057 1/0/0 AAAA 2607:f8b0:4005:807::2004 (60)
2016-09-22 14:03:47.277466 IP google-public-dns-a.google.com.domain > c-73-202-157-15.hsd1.ca.comcast.net.58129: 27259 2/0/0 CNAME googlehosted.l.googleusercontent.com., A 172.217.5.97 (88)
2016-09-22 14:03:47.281903 IP google-public-dns-a.google.com.domain > c-73-202-157-15.hsd1.ca.comcast.net.58129: 648 2/0/0 CNAME googlehosted.l.googleusercontent.com., AAAA 2607:f8b0:4005:808::2001 (100)
2016-09-22 14:04:23.483189 IP google-public-dns-a.google.com.domain > c-73-202-157-15.hsd1.ca.comcast.net.42837: 1442 1/0/0 A 216.58.194.196 (48)
2016-09-22 14:04:23.487838 IP google-public-dns-a.google.com.domain > c-73-202-157-15.hsd1.ca.comcast.net.42837: 30154 1/0/0 AAAA 2607:f8b0:400a:801::2004 (60)
2016-09-22 14:05:26.194178 IP google-public-dns-a.google.com.domain > c-73-202-157-15.hsd1.ca.comcast.net.38130: 41297 1/0/0 A 216.58.195.68 (48)
2016-09-22 14:05:26.200629 IP google-public-dns-a.google.com.domain > c-73-202-157-15.hsd1.ca.comcast.net.38130: 54232 1/0/0 AAAA 2607:f8b0:4005:801::2004 (60)
2016-09-22 14:05:48.989327 IP google-public-dns-a.google.com.domain > c-73-202-157-15.hsd1.ca.comcast.net.43257: 60164 2/0/0 CNAME googlehosted.l.googleusercontent.com., A 172.217.5.97 (88)
2016-09-22 14:05:48.994249 IP google-public-dns-a.google.com.domain > c-73-202-157-15.hsd1.ca.comcast.net.43257: 55681 2/0/0 CNAME googlehosted.l.googleusercontent.com., AAAA 2607:f8b0:4005:804::2001 (100)
2016-09-22 14:06:28.934553 IP google-public-dns-a.google.com.domain > c-73-202-157-15.hsd1.ca.comcast.net.35570: 1958 1/0/0 A 216.58.195.68 (48)
2016-09-22 14:06:28.939352 IP google-public-dns-a.google.com.domain > c-73-202-157-15.hsd1.ca.comcast.net.35570: 16755 1/0/0 AAAA 2607:f8b0:4005:801::2004 (60)
2016-09-22 14:07:31.625806 IP google-public-dns-a.google.com.domain > c-73-202-157-15.hsd1.ca.comcast.net.35305: 17699 1/0/0 A 216.58.195.68 (48)
2016-09-22 14:07:31.630806 IP google-public-dns-a.google.com.domain > c-73-202-157-15.hsd1.ca.comcast.net.35305: 20435 1/0/0 AAAA 2607:f8b0:400a:801::2004 (60)
2016-09-22 14:07:50.756821 IP google-public-dns-a.google.com.domain > c-73-202-157-15.hsd1.ca.comcast.net.41495: 23986 2/0/0 CNAME googlehosted.l.googleusercontent.com., A 216.58.194.161 (88)
